{
  "schema_version": 1,
  "reviewed_at_utc_plus_8": "2026-08-27T00:00:00+08:00",
  "reviewed_by": "POB-CN",
  "runes": [
    {
      "id": "Hayoxi's Soul Core of Heatproofing",
      "text": "海幽夏的耐热灵核",
      "source_path": "src/Data/ModRunes.lua",
      "source_sha256": "85d5f1d2d9e559fc62b79f46c8f9e7e0bfad4f666914dd2919570e558a6fb387",
      "source_locator": "src/Data/ModRunes.lua#Hayoxi's Soul Core of Heatproofing"
    },
    {
      "id": "Zalatl's Soul Core of Insulation",
      "text": "扎拉迪的绝缘灵核",
      "source_path": "src/Data/ModRunes.lua",
      "source_sha256": "85d5f1d2d9e559fc62b79f46c8f9e7e0bfad4f666914dd2919570e558a6fb387",
      "source_locator": "src/Data/ModRunes.lua#Zalatl's Soul Core of Insulation"
    },
    {
      "id": "Topotante's Soul Core of Dampening",
      "text": "托钵塔特的抑制灵核",
      "source_path": "src/Data/ModRunes.lua",
      "source_sha256": "85d5f1d2d9e559fc62b79f46c8f9e7e0bfad4f666914dd2919570e558a6fb387",
      "source_locator": "src/Data/ModRunes.lua#Topotante's Soul Core of Dampening"
    },
    {
      "id": "Atmohua's Soul Core of Retreat",
      "text": "阿特莫瓦的退却灵核",
      "source_path": "src/Data/ModRunes.lua",
      "source_sha256": "85d5f1d2d9e559fc62b79f46c8f9e7e0bfad4f666914dd2919570e558a6fb387",
      "source_locator": "src/Data/ModRunes.lua#Atmohua's Soul Core of Retreat"
    },
    {
      "id": "Quipolatl's Soul Core of Flow",
      "text": "奎波拉特尔的波流灵核",
      "source_path": "src/Data/ModRunes.lua",
      "source_sha256": "85d5f1d2d9e559fc62b79f46c8f9e7e0bfad4f666914dd2919570e558a6fb387",
      "source_locator": "src/Data/ModRunes.lua#Quipolatl's Soul Core of Flow"
    },
    {
      "id": "Tzamoto's Soul Core of Ferocity",
      "text": "提扎墨脱的狂暴灵核",
      "source_path": "src/Data/ModRunes.lua",
      "source_sha256": "85d5f1d2d9e559fc62b79f46c8f9e7e0bfad4f666914dd2919570e558a6fb387",
      "source_locator": "src/Data/ModRunes.lua#Tzamoto's Soul Core of Ferocity"
    },
    {
      "id": "Uromoti's Soul Core of Attenuation",
      "text": "武罗摩提的弱化灵核",
      "source_path": "src/Data/ModRunes.lua",
      "source_sha256": "85d5f1d2d9e559fc62b79f46c8f9e7e0bfad4f666914dd2919570e558a6fb387",
      "source_locator": "src/Data/ModRunes.lua#Uromoti's Soul Core of Attenuation"
    },
    {
      "id": "Opiloti's Soul Core of Assault",
      "text": "欧佩罗蒂的突袭灵核",
      "source_path": "src/Data/ModRunes.lua",
      "source_sha256": "85d5f1d2d9e559fc62b79f46c8f9e7e0bfad4f666914dd2919570e558a6fb387",
      "source_locator": "src/Data/ModRunes.lua#Opiloti's Soul Core of Assault"
    },
    {
      "id": "Guatelitzi's Soul Core of Endurance",
      "text": "瓜铁雷兹的耐力灵核",
      "source_path": "src/Data/ModRunes.lua",
      "source_sha256": "85d5f1d2d9e559fc62b79f46c8f9e7e0bfad4f666914dd2919570e558a6fb387",
      "source_locator": "src/Data/ModRunes.lua#Guatelitzi's Soul Core of Endurance"
    },
    {
      "id": "Xopec's Soul Core of Power",
      "text": "肖佩克的力量灵核",
      "source_path": "src/Data/ModRunes.lua",
      "source_sha256": "85d5f1d2d9e559fc62b79f46c8f9e7e0bfad4f666914dd2919570e558a6fb387",
      "source_locator": "src/Data/ModRunes.lua#Xopec's Soul Core of Power"
    },
    {
      "id": "Estazunti's Soul Core of Convalescence",
      "text": "埃斯塔祖提的康复灵核",
      "source_path": "src/Data/ModRunes.lua",
      "source_sha256": "85d5f1d2d9e559fc62b79f46c8f9e7e0bfad4f666914dd2919570e558a6fb387",
      "source_locator": "src/Data/ModRunes.lua#Estazunti's Soul Core of Convalescence"
    },
    {
      "id": "Tacati's Soul Core of Affliction",
      "text": "塔卡提的折磨灵核",
      "source_path": "src/Data/ModRunes.lua",
      "source_sha256": "85d5f1d2d9e559fc62b79f46c8f9e7e0bfad4f666914dd2919570e558a6fb387",
      "source_locator": "src/Data/ModRunes.lua#Tacati's Soul Core of Affliction"
    },
    {
      "id": "Cholotl's Soul Core of War",
      "text": "查罗特的战争灵核",
      "source_path": "src/Data/ModRunes.lua",
      "source_sha256": "85d5f1d2d9e559fc62b79f46c8f9e7e0bfad4f666914dd2919570e558a6fb387",
      "source_locator": "src/Data/ModRunes.lua#Cholotl's Soul Core of War"
    },
    {
      "id": "Citaqualotl's Soul Core of Foulness",
      "text": "奇塔夸雷特的腐秽灵核",
      "source_path": "src/Data/ModRunes.lua",
      "source_sha256": "85d5f1d2d9e559fc62b79f46c8f9e7e0bfad4f666914dd2919570e558a6fb387",
      "source_locator": "src/Data/ModRunes.lua#Citaqualotl's Soul Core of Foulness"
    },
    {
      "id": "Xipocado's Soul Core of Dominion",
      "text": "夏波卡多的统御灵核",
      "source_path": "src/Data/ModRunes.lua",
      "source_sha256": "85d5f1d2d9e559fc62b79f46c8f9e7e0bfad4f666914dd2919570e558a6fb387",
      "source_locator": "src/Data/ModRunes.lua#Xipocado's Soul Core of Dominion"
    },
    {
      "id": "Soul Core of Tacati",
      "text": "塔卡提的灵核",
      "source_path": "src/Data/ModRunes.lua",
      "source_sha256": "85d5f1d2d9e559fc62b79f46c8f9e7e0bfad4f666914dd2919570e558a6fb387",
      "source_locator": "src/Data/ModRunes.lua#Soul Core of Tacati"
    },
    {
      "id": "Soul Core of Opiloti",
      "text": "欧佩罗蒂的灵核",
      "source_path": "src/Data/ModRunes.lua",
      "source_sha256": "85d5f1d2d9e559fc62b79f46c8f9e7e0bfad4f666914dd2919570e558a6fb387",
      "source_locator": "src/Data/ModRunes.lua#Soul Core of Opiloti"
    },
    {
      "id": "Soul Core of Jiquani",
      "text": "佳华尼的灵核",
      "source_path": "src/Data/ModRunes.lua",
      "source_sha256": "85d5f1d2d9e559fc62b79f46c8f9e7e0bfad4f666914dd2919570e558a6fb387",
      "source_locator": "src/Data/ModRunes.lua#Soul Core of Jiquani"
    },
    {
      "id": "Soul Core of Zalatl",
      "text": "扎拉迪的灵核",
      "source_path": "src/Data/ModRunes.lua",
      "source_sha256": "85d5f1d2d9e559fc62b79f46c8f9e7e0bfad4f666914dd2919570e558a6fb387",
      "source_locator": "src/Data/ModRunes.lua#Soul Core of Zalatl"
    },
    {
      "id": "Soul Core of Citaqualotl",
      "text": "奇塔夸雷特的灵核",
      "source_path": "src/Data/ModRunes.lua",
      "source_sha256": "85d5f1d2d9e559fc62b79f46c8f9e7e0bfad4f666914dd2919570e558a6fb387",
      "source_locator": "src/Data/ModRunes.lua#Soul Core of Citaqualotl"
    },
    {
      "id": "Soul Core of Puhuarte",
      "text": "普华特的灵核",
      "source_path": "src/Data/ModRunes.lua",
      "source_sha256": "85d5f1d2d9e559fc62b79f46c8f9e7e0bfad4f666914dd2919570e558a6fb387",
      "source_locator": "src/Data/ModRunes.lua#Soul Core of Puhuarte"
    },
    {
      "id": "Soul Core of Tzamoto",
      "text": "提扎墨脱的灵核",
      "source_path": "src/Data/ModRunes.lua",
      "source_sha256": "85d5f1d2d9e559fc62b79f46c8f9e7e0bfad4f666914dd2919570e558a6fb387",
      "source_locator": "src/Data/ModRunes.lua#Soul Core of Tzamoto"
    },
    {
      "id": "Soul Core of Xopec",
      "text": "肖佩克的灵核",
      "source_path": "src/Data/ModRunes.lua",
      "source_sha256": "85d5f1d2d9e559fc62b79f46c8f9e7e0bfad4f666914dd2919570e558a6fb387",
      "source_locator": "src/Data/ModRunes.lua#Soul Core of Xopec"
    },
    {
      "id": "Soul Core of Azcapa",
      "text": "阿兹卡帕的灵核",
      "source_path": "src/Data/ModRunes.lua",
      "source_sha256": "85d5f1d2d9e559fc62b79f46c8f9e7e0bfad4f666914dd2919570e558a6fb387",
      "source_locator": "src/Data/ModRunes.lua#Soul Core of Azcapa"
    },
    {
      "id": "Soul Core of Topotante",
      "text": "托钵塔特的灵核",
      "source_path": "src/Data/ModRunes.lua",
      "source_sha256": "85d5f1d2d9e559fc62b79f46c8f9e7e0bfad4f666914dd2919570e558a6fb387",
      "source_locator": "src/Data/ModRunes.lua#Soul Core of Topotante"
    },
    {
      "id": "Soul Core of Quipolatl",
      "text": "奎波拉特尔的灵核",
      "source_path": "src/Data/ModRunes.lua",
      "source_sha256": "85d5f1d2d9e559fc62b79f46c8f9e7e0bfad4f666914dd2919570e558a6fb387",
      "source_locator": "src/Data/ModRunes.lua#Soul Core of Quipolatl"
    },
    {
      "id": "Soul Core of Ticaba",
      "text": "提卡巴的灵核",
      "source_path": "src/Data/ModRunes.lua",
      "source_sha256": "85d5f1d2d9e559fc62b79f46c8f9e7e0bfad4f666914dd2919570e558a6fb387",
      "source_locator": "src/Data/ModRunes.lua#Soul Core of Ticaba"
    },
    {
      "id": "Soul Core of Atmohua",
      "text": "阿特莫瓦的灵核",
      "source_path": "src/Data/ModRunes.lua",
      "source_sha256": "85d5f1d2d9e559fc62b79f46c8f9e7e0bfad4f666914dd2919570e558a6fb387",
      "source_locator": "src/Data/ModRunes.lua#Soul Core of Atmohua"
    },
    {
      "id": "Soul Core of Cholotl",
      "text": "查罗特的灵核",
      "source_path": "src/Data/ModRunes.lua",
      "source_sha256": "85d5f1d2d9e559fc62b79f46c8f9e7e0bfad4f666914dd2919570e558a6fb387",
      "source_locator": "src/Data/ModRunes.lua#Soul Core of Cholotl"
    },
    {
      "id": "Soul Core of Zantipi",
      "text": "赞提佩的灵核",
      "source_path": "src/Data/ModRunes.lua",
      "source_sha256": "85d5f1d2d9e559fc62b79f46c8f9e7e0bfad4f666914dd2919570e558a6fb387",
      "source_locator": "src/Data/ModRunes.lua#Soul Core of Zantipi"
    },
    {
      "id": "Guatelitzi's Thesis",
      "text": "瓜铁雷兹的圣典",
      "source_path": "src/Data/ModRunes.lua",
      "source_sha256": "85d5f1d2d9e559fc62b79f46c8f9e7e0bfad4f666914dd2919570e558a6fb387",
      "source_locator": "src/Data/ModRunes.lua#Guatelitzi's Thesis"
    },
    {
      "id": "Citaqualotl's Thesis",
      "text": "奇塔夸雷特的圣典",
      "source_path": "src/Data/ModRunes.lua",
      "source_sha256": "85d5f1d2d9e559fc62b79f46c8f9e7e0bfad4f666914dd2919570e558a6fb387",
      "source_locator": "src/Data/ModRunes.lua#Citaqualotl's Thesis"
    },
    {
      "id": "Jiquani's Thesis",
      "text": "佳华尼的圣典",
      "source_path": "src/Data/ModRunes.lua",
      "source_sha256": "85d5f1d2d9e559fc62b79f46c8f9e7e0bfad4f666914dd2919570e558a6fb387",
      "source_locator": "src/Data/ModRunes.lua#Jiquani's Thesis"
    },
    {
      "id": "Quipolatl's Thesis",
      "text": "奎波拉特尔的圣典",
      "source_path": "src/Data/ModRunes.lua",
      "source_sha256": "85d5f1d2d9e559fc62b79f46c8f9e7e0bfad4f666914dd2919570e558a6fb387",